{
  "verified_on": "2026-10-15",
  "purpose": "Two-week Amazon Solutions Architect rehearsal: explain the customer decision, tradeoff, failure mode and validation before naming more services.",
  "experience_boundary": "Your OCI and Databricks work is actual experience only where supported by your resume and confirmed details. Every AWS architecture below is a hypothetical translation or practice design, not evidence you deployed it. Say: In my OCI work I did X; on AWS I would evaluate Y because Z. A completed lab is a lab, not production AWS experience.",
  "answer_frame": [
    "Clarify the customer outcome, workload shape, existing estate and constraints.",
    "State measurable requirements: throughput, p95/p99 latency, availability, RPO/RTO, compliance and budget.",
    "Draw the simplest viable data flow; explain why each component earns its place.",
    "Compare one credible alternative and make the cost, reliability and operational tradeoff explicit.",
    "Walk through a failure, detection, recovery and validation experiment; agree the next customer step."
  ],
  "priorities": [
    {
      "id": "P0",
      "name": "Must explain without notes",
      "when": "Days 1-7, then daily retrieval practice. Master these before expanding breadth."
    },
    {
      "id": "P1",
      "name": "Working fluency",
      "when": "Days 6-11. Tie these to a customer scenario and one failure drill."
    },
    {
      "id": "P2",
      "name": "Targeted awareness",
      "when": "Days 10-12, only after P0 is fluent. Deepen if the job description or recruiter emphasizes it."
    }
  ],
  "lab_policy": "Labs are optional and are not executed by this preparation site. Prefer the offline exercise if time or billing access is limited. Use a dedicated sandbox, MFA and temporary credentials. Estimate current regional charges first, use synthetic data and a short timer, and inspect every resource after cleanup. AWS Budgets alerts are not a hard spending cap; billing and notifications can lag. No lab requires NAT gateways, paid database instances, EKS clusters, provisioned concurrency, OpenSearch domains or live Bedrock calls.",
  "sources": [
    {
      "id": "vpc",
      "title": "VPC internet gateway",
      "url": "https://docs.aws.amazon.com/vpc/latest/userguide/VPC_Internet_Gateway.html"
    },
    {
      "id": "nat",
      "title": "NAT gateway",
      "url": "https://docs.aws.amazon.com/vpc/latest/userguide/vpc-nat-gateway.html"
    },
    {
      "id": "sg",
      "title": "Security groups",
      "url": "https://docs.aws.amazon.com/vpc/latest/userguide/vpc-security-groups.html"
    },
    {
      "id": "nacl",
      "title": "Network ACLs",
      "url": "https://docs.aws.amazon.com/vpc/latest/userguide/vpc-network-acls.html"
    },
    {
      "id": "endpoint",
      "title": "Gateway endpoints",
      "url": "https://docs.aws.amazon.com/vpc/latest/privatelink/gateway-endpoints.html"
    },
    {
      "id": "iam",
      "title": "IAM policy evaluation",
      "url": "https://docs.aws.amazon.com/IAM/latest/UserGuide/reference_policies_evaluation-logic.html"
    },
    {
      "id": "compute",
      "title": "Fargate or Lambda decision guide",
      "url": "https://docs.aws.amazon.com/decision-guides/latest/decision-guides/fargate-or-lambda.html"
    },
    {
      "id": "elb",
      "title": "Elastic Load Balancing",
      "url": "https://docs.aws.amazon.com/elasticloadbalancing/latest/userguide/what-is-load-balancing.html"
    },
    {
      "id": "storage",
      "title": "Storage decision guide",
      "url": "https://docs.aws.amazon.com/decision-guides/latest/decision-guides/choosing-aws-storage-service.html"
    },
    {
      "id": "s3",
      "title": "Amazon S3 overview",
      "url": "https://docs.aws.amazon.com/AmazonS3/latest/userguide/Welcome.html"
    },
    {
      "id": "db",
      "title": "Aurora and DynamoDB comparison",
      "url": "https://aws.amazon.com/compare/aurora-and-dynamodb/"
    },
    {
      "id": "rds",
      "title": "RDS Multi-AZ DB instance deployments",
      "url": "https://docs.aws.amazon.com/AmazonRDS/latest/UserGuide/Concepts.MultiAZSingleStandby.html"
    },
    {
      "id": "replica",
      "title": "RDS FAQs and read replicas",
      "url": "https://aws.amazon.com/rds/faqs/"
    },
    {
      "id": "messaging",
      "title": "SQS, SNS and EventBridge decision guide",
      "url": "https://docs.aws.amazon.com/decision-guides/latest/decision-guides/sns-or-sqs-or-eventbridge.html"
    },
    {
      "id": "visibility",
      "title": "SQS visibility timeout",
      "url": "https://docs.aws.amazon.com/AWSSimpleQueueService/latest/SQSDeveloperGuide/sqs-visibility-timeout.html"
    },
    {
      "id": "duplicates",
      "title": "SQS at-least-once delivery",
      "url": "https://docs.aws.amazon.com/AWSSimpleQueueService/latest/SQSDeveloperGuide/standard-queues-at-least-once-delivery.html"
    },
    {
      "id": "stream",
      "title": "Kinesis Data Streams concepts",
      "url": "https://docs.aws.amazon.com/streams/latest/dev/key-concepts.html"
    },
    {
      "id": "dr",
      "title": "Disaster recovery options",
      "url": "https://docs.aws.amazon.com/whitepapers/latest/disaster-recovery-workloads-on-aws/disaster-recovery-options-in-the-cloud.html"
    },
    {
      "id": "ops",
      "title": "Management and governance services",
      "url": "https://docs.aws.amazon.com/whitepapers/latest/aws-overview/management-governance.html"
    },
    {
      "id": "cost",
      "title": "Cost Optimization pillar",
      "url": "https://docs.aws.amazon.com/wellarchitected/latest/cost-optimization-pillar/welcome.html"
    },
    {
      "id": "budget",
      "title": "AWS Budgets and billing delays",
      "url": "https://docs.aws.amazon.com/cost-management/latest/userguide/budgets-managing-costs.html"
    },
    {
      "id": "migration",
      "title": "Migration decision guide",
      "url": "https://docs.aws.amazon.com/decision-guides/latest/decision-guides/migration-on-aws-how-to-choose.html"
    },
    {
      "id": "bedrock",
      "title": "Bedrock data protection",
      "url": "https://docs.aws.amazon.com/bedrock/latest/userguide/data-protection.html"
    },
    {
      "id": "rag",
      "title": "Bedrock Knowledge Bases",
      "url": "https://docs.aws.amazon.com/bedrock/latest/userguide/knowledge-base.html"
    },
    {
      "id": "guardrails",
      "title": "Bedrock Guardrails",
      "url": "https://docs.aws.amazon.com/bedrock/latest/userguide/guardrails.html"
    },
    {
      "id": "analytics",
      "title": "AWS analytics decision guide",
      "url": "https://docs.aws.amazon.com/decision-guides/latest/decision-guides/analytics-on-aws-how-to-choose.html"
    },
    {
      "id": "versioning",
      "title": "S3 Versioning",
      "url": "https://docs.aws.amazon.com/AmazonS3/latest/userguide/Versioning.html"
    },
    {
      "id": "delete-bucket",
      "title": "Deleting an S3 bucket",
      "url": "https://docs.aws.amazon.com/AmazonS3/latest/userguide/delete-bucket.html"
    },
    {
      "id": "hybrid",
      "title": "VPC connectivity options",
      "url": "https://docs.aws.amazon.com/whitepapers/latest/aws-vpc-connectivity-options/introduction.html"
    },
    {
      "id": "kms",
      "title": "AWS KMS",
      "url": "https://docs.aws.amazon.com/kms/latest/developerguide/overview.html"
    },
    {
      "id": "secrets",
      "title": "AWS Secrets Manager",
      "url": "https://docs.aws.amazon.com/secretsmanager/latest/userguide/intro.html"
    },
    {
      "id": "parameters",
      "title": "Systems Manager Parameter Store",
      "url": "https://docs.aws.amazon.com/systems-manager/latest/userguide/systems-manager-parameter-store.html"
    },
    {
      "id": "waf",
      "title": "AWS WAF and Shield",
      "url": "https://docs.aws.amazon.com/waf/latest/developerguide/what-is-aws-waf.html"
    },
    {
      "id": "cdn",
      "title": "Amazon CloudFront",
      "url": "https://docs.aws.amazon.com/AmazonCloudFront/latest/DeveloperGuide/Introduction.html"
    },
    {
      "id": "cache",
      "title": "Amazon ElastiCache",
      "url": "https://docs.aws.amazon.com/AmazonElastiCache/latest/dg/WhatIs.html"
    },
    {
      "id": "eks",
      "title": "Amazon EKS",
      "url": "https://docs.aws.amazon.com/eks/latest/userguide/what-is-eks.html"
    }
  ],
  "topics": [
    {
      "id": "vpc",
      "priority": "P0",
      "domain": "networking",
      "name": "VPC, subnets, routes, IGW and NAT",
      "decision": "Trace DNS, route table, security controls and return traffic. A public subnet has an internet-gateway route; an IPv4 instance also needs a public address for direct internet access.",
      "tradeoff": "Use public ingress with private application/data tiers. NAT supplies outbound IPv4 connectivity, with a cost and availability design to justify.",
      "failure": "A private subnet does not automatically have internet access. Check routes, NAT connectivity, DNS and security rules separately.",
      "say": "I would draw the complete packet path and isolate the first failed hop before changing firewall rules.",
      "probe": "Can the private worker download a package, and what happens if its egress path fails?",
      "sources": [
        "vpc",
        "nat"
      ]
    },
    {
      "id": "network-controls",
      "priority": "P0",
      "domain": "security",
      "name": "Security groups, NACLs and private endpoints",
      "decision": "Security groups are stateful allow controls on associated resources; NACLs are stateless subnet controls with allow and deny rules.",
      "tradeoff": "Use security groups as the main workload boundary; add subnet controls for a specific requirement. Endpoints solve service connectivity, not all authorization.",
      "failure": "A restrictive NACL can block return traffic. A private endpoint policy can still deny a request allowed by a role.",